{"$schema":"https://json-schema.org/draft/2020-12/schema","$id":"system-log-export-result-v1","type":"object","additionalProperties":false,"required":["export_id","requested_by","status","format","filters","record_count","truncated","logical_uri","sha256","created_at","completed_at"],"properties":{"export_id":{"type":"string","minLength":1},"requested_by":{"type":"string","minLength":1},"status":{"const":"succeeded"},"format":{"const":"jsonl"},"filters":{"type":"object"},"record_count":{"type":"integer","minimum":0,"maximum":10000},"truncated":{"type":"boolean"},"logical_uri":{"type":"string","minLength":1},"sha256":{"type":"string","pattern":"^[a-f0-9]{64}$"},"error_code":{"type":["string","null"]},"created_at":{"type":"string","format":"date-time"},"completed_at":{"type":"string","format":"date-time"}}}
