{"export_id":"export-vector-001","requested_by":"operator-1","status":"succeeded","format":"jsonl","filters":{"outcome":"failed"},"record_count":1,"truncated":false,"logical_uri":"system-operations/exports/export-vector-001.jsonl","sha256":"cccccccccccccccccccccccccccccccccccccccccccccccccccccccccccccccc","error_code":null,"created_at":"2026-09-02T00:03:00Z","completed_at":"2026-09-02T00:03:01Z"}
